{
  "$schema": "https://json-schema.org/draft/2020-12/schema",
  "$id": "https://creator-os.local/schemas/analyzer_registry.v2.schema.json",
  "title": "Creator OS Production Analyzer Authority Registry",
  "type": "object",
  "additionalProperties": false,
  "required": [
    "schema",
    "registryId",
    "authorityVersion",
    "analyzers",
    "provenance"
  ],
  "properties": {
    "schema": {
      "const": "creator_os.analyzer_registry.v2"
    },
    "registryId": {
      "type": "string",
      "minLength": 1
    },
    "authorityVersion": {
      "const": 2
    },
    "analyzers": {
      "type": "array",
      "minItems": 1,
      "items": {
        "$ref": "#/$defs/analyzerRegistration"
      }
    },
    "provenance": {
      "$ref": "evidence_provenance.v1.schema.json"
    }
  },
  "$defs": {
    "sha256": {
      "type": "string",
      "pattern": "^[a-f0-9]{64}$"
    },
    "analyzerRegistration": {
      "type": "object",
      "additionalProperties": false,
      "required": [
        "analyzerId",
        "analyzerVersion",
        "evidenceKinds",
        "implementationRef",
        "implementationFingerprint",
        "model",
        "validationDataset",
        "thresholds",
        "thresholdsFingerprint",
        "falsePositiveBudget",
        "falseNegativeBudget",
        "lastQualification",
        "nextRenewal",
        "approvedUseCases",
        "unsupportedUseCases",
        "rollbackVersion",
        "operator",
        "authorityReview"
      ],
      "properties": {
        "analyzerId": {
          "type": "string",
          "minLength": 1
        },
        "analyzerVersion": {
          "type": "string",
          "minLength": 1
        },
        "evidenceKinds": {
          "type": "array",
          "minItems": 1,
          "uniqueItems": true,
          "items": {
            "type": "string",
            "minLength": 1
          }
        },
        "implementationRef": {
          "type": "string",
          "minLength": 1
        },
        "implementationFingerprint": {
          "$ref": "#/$defs/sha256"
        },
        "model": {
          "type": "object",
          "additionalProperties": false,
          "required": [
            "modelId",
            "modelFingerprint"
          ],
          "properties": {
            "modelId": {
              "type": "string",
              "minLength": 1
            },
            "modelFingerprint": {
              "$ref": "#/$defs/sha256"
            }
          }
        },
        "validationDataset": {
          "type": "object",
          "additionalProperties": false,
          "required": [
            "datasetId",
            "datasetOwner",
            "manifestRef",
            "manifestFingerprint"
          ],
          "properties": {
            "datasetId": {
              "type": "string",
              "minLength": 1
            },
            "datasetOwner": {
              "type": "string",
              "minLength": 1
            },
            "manifestRef": {
              "type": "string",
              "minLength": 1
            },
            "manifestFingerprint": {
              "$ref": "#/$defs/sha256"
            }
          }
        },
        "thresholds": {
          "type": "object"
        },
        "thresholdsFingerprint": {
          "$ref": "#/$defs/sha256"
        },
        "falsePositiveBudget": {
          "type": "number",
          "minimum": 0,
          "maximum": 1
        },
        "falseNegativeBudget": {
          "type": "number",
          "minimum": 0,
          "maximum": 1
        },
        "lastQualification": {
          "type": "string",
          "format": "date-time"
        },
        "nextRenewal": {
          "type": "string",
          "format": "date-time"
        },
        "approvedUseCases": {
          "type": "array",
          "minItems": 1,
          "uniqueItems": true,
          "items": {
            "type": "string",
            "minLength": 1
          }
        },
        "unsupportedUseCases": {
          "type": "array",
          "minItems": 1,
          "uniqueItems": true,
          "items": {
            "type": "string",
            "minLength": 1
          }
        },
        "rollbackVersion": {
          "type": "string",
          "minLength": 1
        },
        "operator": {
          "type": "string",
          "minLength": 1
        },
        "authorityReview": {
          "type": "object",
          "additionalProperties": false,
          "required": [
            "reviewId",
            "decision",
            "reviewedAt",
            "approvedChangeClasses",
            "reviewedMaterialFingerprint"
          ],
          "properties": {
            "reviewId": {
              "type": "string",
              "minLength": 1
            },
            "decision": {
              "const": "approved"
            },
            "reviewedAt": {
              "type": "string",
              "format": "date-time"
            },
            "approvedChangeClasses": {
              "type": "array",
              "minItems": 1,
              "uniqueItems": true,
              "items": {
                "enum": [
                  "initial_authority",
                  "threshold_change",
                  "model_upgrade",
                  "detector_removal",
                  "production_authority_expansion",
                  "implementation_change",
                  "qualification_renewal"
                ]
              }
            },
            "reviewedMaterialFingerprint": {
              "$ref": "#/$defs/sha256"
            }
          }
        }
      }
    }
  }
}
